{
  "schema_version": "ets.connector.definition.v1",
  "connector_id": "synthetic.audit",
  "display_name": "Synthetic Audit",
  "description": "Deterministic synthetic polling connector used by the G2A conformance suite.",
  "source_classes": [
    "audit"
  ],
  "adapter_version": "1.0",
  "sdk_contract_version": "ets.connector.sdk.v1",
  "capture_envelope_versions": [
    "ets.capture.v1"
  ],
  "capabilities": {
    "delivery_modes": [
      "poll"
    ],
    "authentication_methods": [
      "none"
    ],
    "discovery": false,
    "checkpointing": true,
    "reconciliation": true,
    "normalization": true,
    "health": true
  },
  "configuration_schema": {
    "instance_schema": "ets.connector.instance.v1",
    "settings_schema_ref": null
  },
  "implementation_class": "enterprise_api",
  "gateway_host_versions": [
    "ets.gateway.connector-host.v1"
  ]
}
