{
  "schema_version": "ets.connector.definition.v1",
  "connector_id": "microsoft.sharepoint.onedrive_delta",
  "display_name": "Microsoft SharePoint and OneDrive Metadata Delta",
  "description": "Governed Microsoft Graph SharePoint/OneDrive metadata-only delta collection using server-owned tenant/cloud/resource profiles and opaque source state.",
  "implementation_class": "enterprise_api",
  "source_classes": ["sharepoint_onedrive_metadata_delta"],
  "adapter_version": "1.0",
  "sdk_contract_version": "ets.connector.sdk.v1",
  "capture_envelope_versions": ["ets.capture.v1"],
  "gateway_host_versions": ["ets.gateway.connector-host.v1"],
  "capabilities": {
    "delivery_modes": ["poll"],
    "authentication_methods": ["bearer"],
    "discovery": true,
    "checkpointing": true,
    "reconciliation": true,
    "normalization": true,
    "health": true
  },
  "configuration_schema": {
    "instance_schema": "ets.connector.instance.v1",
    "settings_schema_ref": "schemas/connectors/v1/enterprise/microsoft-sharepoint-onedrive-delta-settings.schema.json"
  }
}
