{
  "schema_version": "ets.connector.definition.v1",
  "connector_id": "aws.cloudtrail",
  "display_name": "AWS CloudTrail Event History",
  "description": "Polling enterprise connector for bounded AWS CloudTrail management-event observations.",
  "implementation_class": "enterprise_api",
  "source_classes": ["aws_cloudtrail_management_event"],
  "adapter_version": "1.0",
  "sdk_contract_version": "ets.connector.sdk.v1",
  "capture_envelope_versions": ["ets.capture.v1"],
  "gateway_host_versions": ["ets.gateway.connector-host.v1"],
  "capabilities": {
    "delivery_modes": ["poll"],
    "authentication_methods": ["aws_session"],
    "discovery": true,
    "checkpointing": true,
    "reconciliation": true,
    "normalization": true,
    "health": true
  },
  "configuration_schema": {
    "instance_schema": "ets.connector.instance.v1",
    "settings_schema_ref": "schemas/connectors/v1/enterprise/aws-cloudtrail-settings.schema.json"
  }
}
