{
  "schema_version": "ets.connector.definition.v1",
  "connector_id": "native.file_drop",
  "display_name": "Gateway File / Drop",
  "description": "Built-in bounded explicit file/drop intake backed by the qualified Gateway G1E runtime.",
  "implementation_class": "native",
  "source_classes": ["filesystem"],
  "adapter_version": "1.0",
  "sdk_contract_version": "ets.connector.sdk.v1",
  "capture_envelope_versions": ["ets.capture.v1"],
  "gateway_host_versions": ["ets.gateway.connector-host.v1"],
  "capabilities": {
    "delivery_modes": ["push"],
    "authentication_methods": ["gateway_principal"],
    "discovery": false,
    "checkpointing": false,
    "reconciliation": false,
    "normalization": true,
    "health": true
  },
  "configuration_schema": {
    "instance_schema": "ets.connector.instance.v1",
    "settings_schema_ref": "schemas/connectors/v1/native/file-drop-settings.schema.json"
  }
}
