{
  "schema_version": "ets.connector.definition.v1",
  "connector_id": "generic.rest",
  "display_name": "Generic REST JSON",
  "description": "Governed polling connector for bounded declarative extraction from approved HTTPS JSON APIs.",
  "implementation_class": "generic",
  "source_classes": ["rest_json"],
  "adapter_version": "1.0",
  "sdk_contract_version": "ets.connector.sdk.v1",
  "capture_envelope_versions": ["ets.capture.v1"],
  "gateway_host_versions": ["ets.gateway.connector-host.v1"],
  "capabilities": {
    "delivery_modes": ["poll"],
    "authentication_methods": ["none", "bearer"],
    "discovery": false,
    "checkpointing": true,
    "reconciliation": true,
    "normalization": true,
    "health": true
  },
  "configuration_schema": {
    "instance_schema": "ets.connector.instance.v1",
    "settings_schema_ref": "schemas/connectors/v1/generic/generic-rest-settings.schema.json"
  }
}
